{
  "$schema": "https://json-schema.org/draft/2020-12/schema",
  "$id": "ospec://schemas/kernel/assessment/v1",
  "title": "AssessmentV1",
  "description": "Persistable assessment/binding distinct from evidence observation and verification verdict. Verdict is forbidden.",
  "type": "object",
  "schema_version": 1,
  "required": [
    "schema_version",
    "kind",
    "assessment_id",
    "evidence_id",
    "role",
    "obligation_id",
    "node_id",
    "candidate_id",
    "policy_snapshot_id"
  ],
  "properties": {
    "schema_version": {
      "type": "integer",
      "const": 1
    },
    "kind": {
      "type": "string",
      "const": "assessment/v1"
    },
    "assessment_id": {
      "type": "string",
      "pattern": "^sha256:[a-f0-9]{64}$"
    },
    "evidence_id": {
      "type": "string",
      "pattern": "^sha256:[a-f0-9]{64}$"
    },
    "role": {
      "type": "string",
      "minLength": 1
    },
    "obligation_id": {
      "type": "string",
      "minLength": 1
    },
    "node_id": {
      "type": "string",
      "minLength": 1
    },
    "candidate_id": {
      "type": "string",
      "pattern": "^sha256:[a-f0-9]{64}$"
    },
    "policy_snapshot_id": {
      "type": "string",
      "pattern": "^sha256:[a-f0-9]{64}$"
    }
  },
  "additionalProperties": false
}
